number,name,rating,translated_text
1,Wej Chyi Ken,5,"Too squeeze inside, sound proof also not very good. Difficult to chat with the persons who same table. The food is nice and service is good. Hope able upgrade the environment in future."
2,hannahh,4,the food is soo generous and the servers are so attentive but the venue is small and kinda claustrophobic 😀
3,Robin Lau,2,"Food is not bad, but price is slightly higher. New place, environment is good. It was previously located in malim, i commented to them about their sushi rice bland flavour and they still serve the same flavour. Workers are all polite.

ADDED: Came since last time, waited one hour for my grilled squid and we finished all our dishes for 30 mins"
4,Yeanching,5,"Good service and fast food. The price of oysters is slightly high.
You need to plan your meal time because there are too many customers."
5,Kai Chee Too,5,A new Japanese restaurant at malim area.  Serve a lot of variety of japanese cuisine. Food are delicious and well presentation. Reasonable pricing.
6,Aaron Lee,5,Great services and good Japanese food here.
7,Lina Puah,5,"Sushi San is another Japanese restaurant in the Malim area, and it’s a pleasant place for a relaxed Japanese-style meal. The moment we walked in, the staff were warm, friendly, and welcoming, which made the experience comfortable from the start. They offer a wide variety of Japanese dishes, including many individual set meals, which is great for solo diners or anyone who wants a complete meal without ordering too much.

What really stood out is their salad selection. They probably offer one of the widest ranges of salads among Japanese restaurants in Melaka. The portions are generous, and the salads are filling enough to be enjoyed as a light meal on their own. This is a nice option if you want something lighter or more refreshing.

I had already eaten a bit before dinner, so I didn’t order too many dishes. Still, everything arrived quickly, which I appreciated. Besides the usual green tea, they also serve genmaicha (roasted brown rice tea), which adds a nice Japanese touch.

The restaurant interior has a clean and cosy izakaya-style vibe, making it a comfortable place to hang out with friends or family. Overall, Sushi San offers a pleasant dining experience with good variety, fast service, and a friendly atmosphere. It’s definitely a nice addition to the Japanese food scene in Malim."
8,KHOO LI JUAN,5,Not bad~
9,Jun Feng,5,"Sushi San is an advanced japanese food restaurant just migrated to Kota Syahbandar. The food their serving are extremely good. Waitresses are very welcoming, attentive and patient in explaining to make sure you have the best dining experience!"
10,希爾威思特,5,"Rich menu choices, good food taste and service"
11,Ee Han Ong,5,Nice food and service. With a nice birthday platter.
12,Sky Teow,4,Good environment and foods is overall good for all items I had orders .
13,Sun Ng,5,Nice food
14,Fen Private,1,Super irresponsible shop! Keep changing address and never update. Wasting ppl time.
15,Grace Lim,5,The food was delicious and the service was excellent.
16,Tong Mun Kit,5,"Celebrated my father's birthday here. Fantastic experience, service were excellent.
Nice environment, friendly staff and delicious food."
17,Jack Lim,5,The landlady is very kind and beautiful!The food is also delicious
18,Jonathan Lee,3,"Dined here as a big group of 10. The food, unquestionably, was of good variety, tasty, and of good value. However, the service left much to be desired. Our orders were mixed up, and we had to signal repeatedly for wasabi and pickled ginger. The surroundings weren't great too as it was quite loud in the shop and the lazy susan in the middle of the table made it not conducive to dine our teishoku sets. Overall, much space for improvement."
19,Zyong Tan,5,Nice food and good service.
20,yu ting Chin,5,"Nice food, good service, celebrate birthday here"
21,cj7 tan,5,Beautiful environment and delicious food
22,AH JIA,5,Great service and delicious food🥰
23,LimKoppi,3,Food is ok.Mainly because Malim has a good location.
24,허태경,5,The atmosphere is nice and the food is clean and delicious.
25,steve chan,4,"The food is delicious, but it seems a bit unwelcoming to obese people"
26,Eason Loh,5,"Had my kid’s birthday celebration here. We were surprise by the present from the restaurant. Fantastic experience, service were excellent."
27,ryant,4,Very friendly and polite staff.
28,Martin Soon,5,"Visited this Japanese restaurant recently and had a pleasant experience overall. The food was okay — the standout items were definitely the fresh uni and salmon sashimi, which were both of great quality. The atmosphere was cozy with nice vibes, making it a comfortable place to enjoy a meal. Service was excellent, staff were friendly and attentive, and food was served very quickly without much waiting time. Overall, it’s a good spot for a casual Japanese meal with efficient service and a welcoming environment."
29,Cheng Kui Tay,5,It would be better if the business starts at 11:30 on Saturdays and Sundays🙏
30,cheryl chew,5,"The sashimi is fresh, good service and nice environment"
31,Andrew Tan,4,"Overall experience quite good, food ok. Just need wait a bit peak time."
32,Chantel Beh,5,"Food is delicious and affordable. The portion is also quite big, which we didn’t expect to not be able to finish 😭😂 overall the dining experience was very satisfying definitely coming again next time 👍"
33,Chelesea,5,AMAZING FOOD + GORGEOUS INTERIOR + LOVELY STAFFS 🤤💗 10/10!!! definitely recommend
34,Zaito,4,Food is good but still have room for improvement
35,Chia Hon Tan,5,Excellent services with delicious food
36,Sara Kuah,5,"The food is delicious. I usually choose this restaurant when eating Japanese food.
If you spend a certain amount recently, there will be a lucky draw."
37,Wui WenYing,5,"Had an amazing dining experience at Sushi San Melaka. Delicious food, cozy ambiance and great service. Highly recommend!"
38,Ben Ong,5,Nice food and good service
39,m f,5,"I have visited here several times and the food never disappoints me. The cuisines are basically delicious.

What makes me decided to post a review is because of this. I made a last minute reservation a day before a birthday surprise and had also made a special request for the staff to help decorate the private room. I passed my decor stuff and left due to time constraint, and I didn't expect they are so skillful in decors!

They are so helpful. One of the number balloons was burst before we reached the restaurant. The owner called me to ask me whether I have more spare number balloons. I didn't have one. She went out to buy for me 🥺🥺

Thank you Sushi San! Top notch food and team! ❤️❤️"
40,Corly Mika Lee,5,"Love their food.
.
Japanese food that everyone will want to eat when visiting Malacca.Friends who like sashimi, don’t miss the #sashimi # recommendation here. The cut is top-notch.Delicious and thick, every bite is full of deliciousness, and every bite has a smooth and tender fish texture.# delicious 😘😋
.
Ps: It is worth mentioning that their takeaway food is packaged with care and is equally delicious.#sincerelyrecommended"
41,Jayron Chong,1,"Bad service and bad attitude , food are so so only, not fresh and price at high side

Can’t accept customer comment then dun open shop. Ur staff behave like this still like ntg wrong with ur staff, look at his tone of voice when answering me. Patient ? This call patient ? After my son took ur food then got diarrhea d. This is so call fresh ?
Adjust the price ? Did I ask to adjust? What a joke. Halo, ask ur staff properly ok."
42,Ben Tan,3,"Quality of the food score about 2.5/5 stars ..
Raw food got room to improve. ..
Service recovery excellent.. they know how to make a good service management."
43,Y O,3,"Food is alright, but there are other better options for Japanese cuisine in Melaka.

1. Ramen - Broth tasted alright, not too salty 👍🏻

2. Pork cutlet - Pork was thin for this price. Other restaurants serve thicker slices for this price 😅

3. Grilled chicken - This was the nicest food we had at Sushi San!

4. Pizza - Tasted alright, no wow factor to it

5. Ramen + grilled salmon - Not worth it, salmon was super small for the price charged.

6. Sushi - Sushi rice was under-seasoned? Not sure if it was the day we went only or it does taste like this on any other days.

7. Japanese rice - Very soft and sticky, again, not sure if it was the day we went only or it does taste like this on any other days.

8. Ambience & service - Environment was nice, we were able to have our own space to eat upon request. I appreciate that ☺️ service was considered good too as the waitress did constantly come to check our tea and refilled it for us"
44,sharon low,5,Staffs were very friendly and very efficient in service
45,Lim Jia Jia,5,"Staff is friendly and food is served hastily. Has free wifi, got air cond, very nice japanese wood hut vibe! Food price is reasonable for it's amount and quality"
46,Zex0419,5,"The tonkotsu ramen tastes good, the soup is rich and sweet, and the grilled fish is also very delicious.The test level and saltiness are just right."
47,Choon Meng Ho,1,"I was very disappointed to see a cockroach on our table while dining. It made the experience uncomfortable.

This raised serious concerns about the cleanliness of the restaurant. I informed the staff, but I didn’t see any immediate action taken."
48,ericchoo,4,"Food is nice above average.
But the wasapi can't make it, Thai green seafood souce match perfectly with Jap food remember."
49,Tay yee en Paris,5,Happy birthday Joey
50,EL Wardrobe,5,Happy birthday joey
51,Jason Tan,5,Happy birthday Joey
52,Tan Chee Kiong,5,"Happy Birthday, Joey"
53,vy teng,5,Happy birthday Joey
54,YOLO,5,"KSB, Melaka. Not bad. Worth coming back."
55,Katherine Yong,5,Good service and great food!
56,yen fen,5,Happy birthday joey
57,Chinkiat Yong,5,Happy birthday joey
58,Michaelim81 Lim,5,Nice food and good service
59,lee jane,5,"My son’s favorite Japanese food...It is also his designated store.
The food is good and suitable for the whole family."
60,Jarod Quek Yeung Shern,5,Good environment and food is good
61,ah di,5,"I enjoyed the food, the atmosphere was perfect for a meet up!"
62,Jan Ng,5,Excellent！！！
63,Cherryykx,5,Good food good environment
64,Jeanne C,5,"Very nice environment,food serve freshly and big portion,staff very polite,serve customers well, overall quite satisfied with everything.a good place to have a lunch here too as they do serve met menu......"
65,Ng Szewei,5,Really love the food
66,Yun Yew Yong,5,Good Japanese food in Melaka!
67,素芳（小妹）,5,Very delicious!The garlic chicken set is very delicious😋the service is also very good❤️
68,Steffie Chan,5,"Good service, good food!"
69,Yuan Bin Chai,5,"Food is delicious, survice is good"
70,levin tai,5,"Nice delicious, service so good, friendly"
71,James Ong,5,Good taste
72,Geg Nny See,5,"Nice place, nice food and good service"
73,G K,5,The food is delicious and the staff is very polite❤️
74,aaron tan,5,Good food at a good price
75,Yee Wen,5,"An affordable Japanese restaurant in Malacca. The dishes are diverse, the portions are generous, and the taste is very good.A Japanese restaurant suitable for families to enjoy."
76,Shau Y Tan,5,Nice food & excellent service 👍🏻👍🏻👍🏻 definitely will come back
77,WIS WAN,5,Good tasty
78,Teck huay Chin,5,Good service n food.
79,Tee Eng Tiong,5,Good food good service
80,Brandon Liew,5,Food is good and service is good as well
81,PeiQing Tan,5,The food is delicious 😋
82,GOH MEI HUI,2,"The buffet is very poor. There are many choices on the menu, but when you get there, it's only half of the menu or less. The sashimi is thin and the only thing you can eat is grilled scallop. There's nothing you want to eat."
83,V beauty Venner,5,Very good
84,Joanne Tan,5,Nice food and place
85,Sk Lim,5,The food is fresh and delicious. The environment is good and comfortable. The service attitude is good.
86,Mei Khoo,5,Good
87,sy soh,5,"Delicious food, good service, food come fast👍🏻"
88,YongKeng Tan,5,very good
89,ycs ycs,5,Good 👍
90,Jo Seah,5,Excellent Food. Superb Service. Highly recommended.
91,Mai QN,5,Food and atmosphere is good!
92,Tc Wong,5,Very nice
93,Jiunn Tan,5,"Nice environment, nice food"
94,林雯瑄,5,Delicious. Very good service.
95,jiawei tai,5,"good
service good"
96,Hui Xuan Yong,5,Very delicious 😋
97,ng zhenming,5,"good services, nice food and good atmosphere, affordable price."
98,Chen Hui,5,"Food here is good , ingredients is fresh! Highly recommended"
99,Lichun Ea,5,"First try here. Have a nice experience and received a friendly explanation & recommendation by the little cute short hair lady staff. Overall food are very nice and tasteful, especially the full vegetable sushi.. Will come back again for sure.."
100,Shyenshyen,5,Highly recommended
101,TENG TZE MIN,5,Very nice food and environment.
102,麻辣bunny 0o0,5,nice serving
103,Cherrie Chan,5,Great Japanese food with super friendly staff.
104,YAP KOK SHENG,5,Very delicious sushi 👍
105,Jolyn Toh,5,"Food fresh, staff friendly"
106,Shiow Chien Low,5,🫰🏻🫰🏻🫰🏻delicious😋😋😋
107,Chun Siang Chew,5,Great atmosphere and hospitality
108,Wei Ching,5,Sushi delicious
109,canus chiew,5,"Nice environment, good taste"
110,Alice Lei,5,The best in town! Highly recommended! Must try in Melaka.
111,Joann Chia,5,The food is delicious
112,Caden Tan,5,Good
113,Ju Ying Thye,5,The food is delicious and service is good.
114,vivian koh,5,"Nice food, good services😋"
115,Melissa Goh,5,Nice food and environment. Good service provided from staff.
116,Tan Stephanie,5,"Tasty & nice Japanese food with comfortable dining environment. Our menu meal is recommended by the friendly charming lady boss, we like the Hamachi sashimi, salmon belly fresh & nice,  unagi pizza taste very good. They served very delicious sushi like unagi Ebi tempura maki, awabi kaki maki and cheese salmon kaboca. We had mochi & ice cream treated as a birthday dessert by the lady boss. 🙏🙏🙏🥰🥰🥰"
117,Desmond Tan,5,Very nice service and foods was fresh as expectations..
118,WeiWen Chin,5,"The food is delicious
Service is very good"
119,Jafern Bong,5,Food is delicious and fresh
120,YU Han,5,"Nice food and nice service
Very delicious Japanese food"
121,Soon Wee Nee,5,The environment is very comfortable and the food is delicious. The waiters are very kind and polite. The price is favorable. It is a recommended Japanese restaurant.
122,Nicole Teo,5,"Good environment,nice food"
123,lee chaiyin,5,good service
124,蔡淑虹,5,It’s so delicious and the service is also very good ~ great
125,Adeline Lim,5,good service
126,Gerald Chua,5,Food is generously enough... Taste is good and very Valuable! Garlic Fried Rice is recommended and Salmon Cheese Sushi too!
127,CY. KEK,5,Nice Japanese food. Good service. Sushi is fresh. Fried rice (salmon garlic) is recommended. Preferably prepare dining utensils for grill chicken (a la carte).
128,Jane Pooe,5,Nice pizza
129,Christine MK,5,Nice environment and nice dining
130,Ong Chai Peng,5,Food portion is big and delicious. Child friendly as well.
131,Joyi_97,5,Good food 🥰
132,Jet Lee,5,The atmosphere and food are both good🙌🏻
133,yu ern tan,5,Food are delicious and the service are good
134,Kelvin Loh,5,"Very nice food and good service, always can see the smile on the waiters face. Food very delicious and fresh."
135,。。,5,"Delicious, big portions, air-conditioned, good environment"
136,Tai Chia Nee Joey,5,Good food and nice service
137,Estelle Wang,5,Food is very delicious and worth the price.
138,Stefan Tay,5,Nice and reasonable price ..
139,JiaSheng John,5,The food and environment are very good!
140,Sinyee Lai,5,Comfortable environment and delicious food
141,JOON HAN GOH,5,Good food and environment
142,Amber Tam,5,"Nice environment, friendly staff and delicious food. One of the best Japanese restaurants in Malacca. Would recommend ☺️"
143,Ong Rae Lynn,5,Nice food & service
144,zicadabra,5,"Love the chawan mushi and shake salmon!
⚠️ Recommended to make reservations."
145,Pat Law,5,Very nice food. Is fresh and tasty. Staffs are nice too. Will come back next time.
146,Tan Jie Ying,4,Food very nice and delicious. Environment is comfort. Service also good.
147,Caroline Ratnaike,5,Good service
148,li xue,5,The food is huge and delicious😋
149,陈慧玲,5,Delicious👍
150,Alvin Yong,1,"Japanese Buffet, but shahimi only available one time"
