Review,food_rating,service_rating,atmosphere_rating,Review_clean,Review_en,sentiment
"Price can compared to Fugo Ryori. Ambiance is comfortable and wide and staff is very polite in servings. Ordered wasabi grilled beef , not bad but a little less. Since lunch time, then ordered their lunch ramen set with tempura sides. The ramen soup is flavorful pork bone  taste with nice marinated charsiew(roasted pork). Tempura is crispy and well-fried.",,,,"Price can compared to Fugo Ryori. Ambiance is comfortable and wide and staff is very polite in servings. Ordered wasabi grilled beef , not bad but a little less. Since lunch time, then ordered their lunch ramen set with tempura sides. The ramen soup is flavorful pork bone taste with nice marinated charsiew(roasted pork). Tempura is crispy and well-fried.","Price can be compared to Fugo Ryori. Ambiance is comfortable and wide and staff is very polite in serving. Ordered wasabi grilled beef, not bad but a little less. Since lunch time, then ordered their lunch ramen set with tempura sides. The ramen soup is flavorful pork bone taste with nice marinated charsiew(roasted pork). Tempura is crispy and well fried.",positive
okok,,,,okok,ook,neutral
Delicious food and reasonable price. Recommended to those Japanese foods lover,,,,Delicious food and reasonable price. Recommended to those Japanese foods lover,Delicious food and reasonable price.,positive
Order type: Meal type:,,,,Order type: Meal type:,Order type: Meal type:,neutral
Order type: Meal type:,,,,Order type: Meal type:,Order type: Meal type:,neutral
"The food is very nice, I forgot what I ordered but it is super nice. The chicken is very smooth. It is so special. The price is a bit pricey but the food and the portion deserve it. Good service👍🏼rmb to reserve before dine in.",,,,"The food is very nice, I forgot what I ordered but it is super nice. The chicken is very smooth. It is so special. The price is a bit pricey but the food and the portion deserve it. Good service👍🏼rmb to reserve before dine in.","The food is very nice, I forgot what I ordered but it is super nice. The chicken is very smooth. It is so special. The price is a bit expensive but the food and the portion deserve it. Good service👍🏼rmb to reserve before dinner in.",positive
Great place for japanese food lovers.,,,,Great place for japanese food lovers.,Great place for Japanese food lovers.,positive
Nice food and good service,,,,Nice food and good service,Nice food and good service.,positive
My 2nd fav RESTAURANT on MELAKA,,,,My 2nd fav RESTAURANT on MELAKA,My second favorite restaurant on Melaka .,positive
"Helpful staff, good food, worth the price.",,,,"Helpful staff, good food, worth the price.","Helpful staff, good food, worth the price.",positive
Good food& svc too,,,,Good food& svc too,Good food and stuff too.,positive
Bad service. I placed and paid for my order at 1.04pm. Guess what? I have to wait in my car until 2.02pm for my takeaway ! What a lousy service,,,,Bad service. I placed and paid for my order at 1.04pm. Guess what? I have to wait in my car until 2.02pm for my takeaway ! What a lousy service,Bad service. I placed and paid for my order at 1:04pm. guess what? I have to wait in my car until 2:02pm for my takeaway! What a lousy service!,negative
"I had takeways. Even though the order wasnt much, the waiter was friendly. Sushi was fresh and price was affordable. Not to mention, the place was clean and followed proper SOP",,,,"I had takeways. Even though the order wasnt much, the waiter was friendly. Sushi was fresh and price was affordable. Not to mention, the place was clean and followed proper SOP","Even though the order was not much, the waiter was friendly, sushi was fresh and the price was affordable, not to mention, the place was clean and followed proper SOP",positive
非常开心 可以在父亲节 让爸爸享用到那么美味日本料理 。也庆幸我提早点单，真的太多人。吓得我赶紧点单后上车。还好看到店员都有进行消毒措施，才放心。下次还会在订购的。加油Ichi Zen 继续保持良好,,,,非常开心 可以在父亲节 让爸爸享用到那么美味日本料理 。也庆幸我提早点单，真的太多人。吓得我赶紧点单后上车。还好看到店员都有进行消毒措施，才放心。下次还会在订购的。加油Ichi Zen 继续保持良好,"It's so nice to be able to get Dad to enjoy such delicious Japanese food on Father's Day. It's also nice that I ordered early, too many people. It's scary that I rushed to the car after ordering.",positive
在马六甲非常不错的日本餐大❤️,,,,在马六甲非常不错的日本餐大❤️,Japanese food is very good in Malayalam❤️,positive
Good ambience but average food. Not much choice in Melaka. It’s still considered not bad in Melaka.,,,,Good ambience but average food. Not much choice in Melaka. It’s still considered not bad in Melaka.,Good atmosphere but average food. Not much choice in Melaka. It's still considered not bad in Melaka.,neutral
The service is very good and the food is fresh!  So happy to forget to take pictures😅,,,,The service is very good and the food is fresh! So happy to forget to take pictures😅,The service is very good and the food is fresh! So happy to forget to take pictures😅,positive
Good guest service and food is fresh,,,,Good guest service and food is fresh,Good guest service and fresh food,positive
"A very clean restaurant, following SOP. Staff are courteous. Food is good...",,,,"A very clean restaurant, following SOP. Staff are courteous. Food is good...","A very clean restaurant, following SOP, staff are courteous, food is good...",positive
食物，环境都不错,,,,食物，环境都不错,Food and environment are good.,positive
Still the best Sushi restaurant in Melaka,,,,Still the best Sushi restaurant in Melaka,Still the best sushi restaurant in Melaka,positive
Salmon belly sold here among the best I've tasted. Worth to order of you're into shashimi...,,,,Salmon belly sold here among the best I've tasted. Worth to order of you're into shashimi...,Salmon belly sold here among the best I've tasted.,positive
"Well designed & good renovation.Comfortable for Japanese food dining.Although a bit expensive, the food portion is more than enough to filled your stomach.",,,,"Well designed & good renovation.Comfortable for Japanese food dining.Although a bit expensive, the food portion is more than enough to filled your stomach.","Well designed & good renovation.Comfortable for Japanese food dining.Although a bit expensive, the food portion is more than enough to fill your stomach.",positive
"Overall is good in term of food quality, pricing and service. Most importantly, the shashimi is fresh. The salmon belly was so good.",,,,"Overall is good in term of food quality, pricing and service. Most importantly, the shashimi is fresh. The salmon belly was so good.","Overall is good in terms of food quality, pricing and service. Most importantly, the shashimi is fresh. The salmon belly was so good.",positive
Sashimi is fresh and thick! Price is reasonable. They have lunch set and that makes it more worth. Their last call for lunch is 2:15pm and closing at 2:30pm.,,,,Sashimi is fresh and thick! Price is reasonable. They have lunch set and that makes it more worth. Their last call for lunch is 2:15pm and closing at 2:30pm.,Sashimi is fresh and thick! Price is reasonable. They have lunch set and that makes it more valuable. Their last call for lunch is 2:15pm and closing at 2:30pm.,positive
"I love this place very much, food nice, deco nice, and the most important is they have lunch set with special price. RM 18.90 for a set with 2 main dishes. Use public bank card to pay can get more 10% discount. It's worth having lunch there.",,,,"I love this place very much, food nice, deco nice, and the most important is they have lunch set with special price. RM 18.90 for a set with 2 main dishes. Use public bank card to pay can get more 10% discount. It's worth having lunch there.","I love this place very much, nice food, deco nice, and the most important thing is they have lunch set with special price. RM 18.90 for a set with 2 main dishes. Use public bank card to pay can get more 10% discount. It's worth having lunch there.",positive
This wanfun canpon is good.. this is a must. will come again next time,,,,This wanfun canpon is good.. this is a must. will come again next time,This fancy canpon is good... this is a must. Will come again next time,positive
Excellent service and generous portions of quality ingredients. Will return.,,,,Excellent service and generous portions of quality ingredients. Will return.,Excellent service and generous portions of quality ingredients.,positive
Bad experienced. Not flexible at all. Noncense.,,,,Bad experienced. Not flexible at all. Noncense.,"Bad experience, not flexible at all.",negative
Mesti sedap makanan kat sini.selalu saya datang ramai jer org,,,,Mesti sedap makanan kat sini.selalu saya datang ramai jer org,The food must be good here. I've always been crowded.,positive
"Horrible experience here, first time, cockroaches crawling on the walls, second time, services was horrible, basically ignoring us the whole time. Don't ever come here as a big group, honestly not worth at all. One star for the only staff who actually bothered giving us the menu, the others especially the ""captains"" can just be demoted or fired.",,,,"Horrible experience here, first time, cockroaches crawling on the walls, second time, services was horrible, basically ignoring us the whole time. Don't ever come here as a big group, honestly not worth at all. One star for the only staff who actually bothered giving us the menu, the others especially the ""captains"" can just be demoted or fired.","Horrible experience here, first time, cockroaches crawling on the walls, second time, services were horrible, basically ignoring us all the time. Never come here as a big group, honestly not worth at all. One star for the only staff who actually bothered to give us the menu, the others especially the ""captains"" can just be demoted or fired.",negative
Service: 5/5Food: 4/5Price: Above averageEnvironment: 4/5Cleanliness: 5/5,4.0,5.0,,Price: Above averageEnvironment: 4/5Cleanliness: 5/5,Price: above averageEnvironment: 4/5 Cleanliness: 5/5,positive
Variety of delicious & presentable Japanese cuisine,,,,Variety of delicious & presentable Japanese cuisine,Variety of delicious & presentable Japanese cuisine,positive
"If you guys come here, you Must try the ramen. So good! Portion is big and the taste is Bomb. Had the salmon sushi with truffle sauce, was insanely good! will definitely come here again",,,,"If you guys come here, you Must try the ramen. So good! Portion is big and the taste is Bomb. Had the salmon sushi with truffle sauce, was insanely good! will definitely come here again","If you guys come here, you must try the ramen. so good! portion is big and the taste is Bomb. had the salmon sushi with truffle sauce, was insanely good! will definitely come here again",positive
"Came here for the first time on 10th August (yesterday) after seeing that so many local Melaka favourites were all closed (and also since this is a 3 minute walk away from Swan Garden Hotel).Staff was frendly with good service and greeted our family in the Japanese style (of course, this is a Japanese restaurant after all)My meal consisted of (Nigiri Sushi) 2 Unagi, 2 Tamago and 2 Inari, as well as the Unagi Don, Chawan Mushi and Miso Soup. While it is a bit more expensive than most Japanese chain restaurants, the taste is well worth the price! I enjoyed every moment of the meal.One thing that consistently caught my attention was the Studio Ghibli piano music playing over the speakers. I heard Carrying You, Name of Life, Town with an Ocean View, Path of the Wind, as well as songs from other Ghibli movies I haven't seen yet. Being a huge Ghibli fan myself, it greatly lifted my mood (but this does not make my review biased). I made sure to heap praise (about the music) upon the staff at the counter! LOLGiven the chance I would definitely come back (which is unfortunately unlikely since I live in KL!)",,,,"Came here for the first time on 10th August (yesterday) after seeing that so many local Melaka favourites were all closed (and also since this is a 3 minute walk away from Swan Garden Hotel).Staff was frendly with good service and greeted our family in the Japanese style (of course, this is a Japanese restaurant after all)My meal consisted of (Nigiri Sushi) 2 Unagi, 2 Tamago and 2 Inari, as well as the Unagi Don, Chawan Mushi and Miso Soup. While it is a bit more expensive than most Japanese chain restaurants, the taste is well worth the price! I enjoyed every moment of the meal.One thing that consistently caught my attention was the Studio Ghibli piano music playing over the speakers. I heard Carrying You, Name of Life, Town with an Ocean View, Path of the Wind, as well as songs from other Ghibli movies I haven't seen yet. Being a huge Ghibli fan myself, it greatly lifted my mood (but this does not make my review biased). I made sure to heap praise (about the music) upon the staff at the counter! LOLGiven the chance I would definitely come back (which is unfortunately unlikely since I live in KL!)","Came here for the first time on 10th August (yesterday) after seeing that so many local Melaka favorites were all closed (and also since this is a 3-minute walk away from Swan Garden Hotel).Staff was friendly with good service and greeted our family in Japanese style (of course, this is a Japanese restaurant after all) My meal consisted of (Nigiri Sushi) 2 Unagi, 2 Tamago and 2 Inari, as well as the Unagi Don, Chawan Mushi and Miso Soup. While it is a bit more expensive than most Japanese chain restaurants, the taste is well worth the price! I enjoyed every moment of the meal. One thing that consistently caught my attention was the Studio Ghibli playing piano music over the speakers. I heard Carry You, Name of Life, with a View of the Wind, Raise of the Wind, as well as the other Ghibli Ghibli songs, which I have not seen since I have made sure to make my staff feel good about the music (LOL), but being a huge fan of the movie, I definitely didn't make it come back (LOL!)",positive
Over price food. Ordered ishiyaki kuro buta shogayaki don. In that huge bowl of stone pot prolly it’s only filled with 2 or 3 slice of pork. Truly disappointing. For that price I was hoping for a little more of that iberico pork.,,,,Over price food. Ordered ishiyaki kuro buta shogayaki don. In that huge bowl of stone pot prolly it’s only filled with 2 or 3 slice of pork. Truly disappointing. For that price I was hoping for a little more of that iberico pork.,Over-priced food. ordered ishiyaki kuro buta shogayaki don. in that huge bowl of stone pot prolly it's only filled with 2 or 3 slices of pork. really disappointing. for that price i was hoping for a little more of that iberico pork.,negative
A place for non-muslims,,,,A place for non-muslims,A place for non-Muslims,neutral
1 of the korean restaurant that have a reasonable price and good services for non muslim..,,,,1 of the korean restaurant that have a reasonable price and good services for non muslim..,One of the Korean restaurants that have a reasonable price and good services for non-Muslims..,positive
"During this MCO period, this restaurant takes special precautions to ensure diners' wellbeing & health.I was there last evening and was pleasantly surprised to see that the serving staff use special tongs to place our plates, etc on our table. All the plates etc had been steamed.Serviettes were wrapped in special 'envelopes' and an 'envelope' was also provided for our face masks.Kudos to the management.",,,,"During this MCO period, this restaurant takes special precautions to ensure diners' wellbeing & health.I was there last evening and was pleasantly surprised to see that the serving staff use special tongs to place our plates, etc on our table. All the plates etc had been steamed.Serviettes were wrapped in special 'envelopes' and an 'envelope' was also provided for our face masks.Kudos to the management.","During this MCO period, this restaurant takes special precautions to ensure the well-being and health of diners.I was there last evening and was pleasantly surprised to see that the serving staff use special tongs to place our plates, etc. on our table. All the plates etc. had been steamed.Serviettes were wrapped in special 'envelopes' and an 'envelope' was also provided for our face masks.Kudos to the management.",positive
服务员很好专业,,,,服务员很好专业,Servants are very professional.,positive
"Sushi were too small in size, fuugo ryori much better.",,,,"Sushi were too small in size, fuugo ryori much better.","Sushi was too small in size, fuugo ryori much better.",negative
Nice and cosy restaurant,,,,Nice and cosy restaurant,Nice and cozy restaurant,positive
Food quality overall is nice but I loves the black truffles dishes. The black truffles glass noodles is a must try dish here.,,,,Food quality overall is nice but I loves the black truffles dishes. The black truffles glass noodles is a must try dish here.,The overall food quality is nice but I love the black truffle dishes.,positive
"5 stars for their saba shioyaki. Been to several japanese restaurants but no one does saba shioyaki like them. It is the best saba I have ever tried. They have a wide variety of food for you to choose with reasonable price. Really, for that quality, I'm more than willing to pay! I think I'm gonna have a hard time finding a good saba shioyaki in KL after this game changer.",,,,"5 stars for their saba shioyaki. Been to several japanese restaurants but no one does saba shioyaki like them. It is the best saba I have ever tried. They have a wide variety of food for you to choose with reasonable price. Really, for that quality, I'm more than willing to pay! I think I'm gonna have a hard time finding a good saba shioyaki in KL after this game changer.","5 stars for their saba shioyaki. I've been to several Japanese restaurants but no one does saba shioyaki like them. It's the best saba I've ever tried. They have a wide variety of food for you to choose at a reasonable price. Really, for that quality, I'm more than willing to pay! I think I'm going to have a hard time finding a good saba shioyaki in KL after this game changer.",positive
One of the best Japanese resturant in Melaka,,,,One of the best Japanese resturant in Melaka,One of the best Japanese restaurants in Melaka,positive
Good food,,,,Good food,Good food,positive
Delicious food and nice ambience.The staff are friendly.Yesterday went to have dinner here with my friend from Singapore.I call this restaurant around 4.30pm to make a reservation at 7pm and the staff say alright and the staff call back I am sorry miss can you come around 6.30pm because have event at 8pm to 10pm.Feeling a bit disappointed because the staff didn’t tell the true at first when I make a reservation and feel sorry for my friend who come far away and need to rush down from toll to the restaurant. I hope the staff will take notice.,,,,Delicious food and nice ambience.The staff are friendly.Yesterday went to have dinner here with my friend from Singapore.I call this restaurant around 4.30pm to make a reservation at 7pm and the staff say alright and the staff call back I am sorry miss can you come around 6.30pm because have event at 8pm to 10pm.Feeling a bit disappointed because the staff didn’t tell the true at first when I make a reservation and feel sorry for my friend who come far away and need to rush down from toll to the restaurant. I hope the staff will take notice.,Delicious food and nice atmosphere.The staff are friendly.Yesterday I went to dinner here with my friend from Singapore.I called this restaurant around 4.30pm to make a reservation at 7pm and the staff said okay and the staff called back I'm sorry miss can you come around 6.30pm because I have an event at 8pm to 10pm.Feeling a little disappointed because the staff didn't tell the truth at first when I made a reservation and feel sorry for my friend who comes far away and needs to hurry down from toll to the restaurant.I hope the staff will take notice.,positive
Excellence food and service,,,,Excellence food and service,Excellence in food and service,positive
食材新鲜，好吃。,,,,食材新鲜，好吃。,The food is fresh and delicious.,positive
Always have a great service and wounderful foods...,,,,Always have a great service and wounderful foods...,Always have a great service and wonderful food...,positive
The sashimi was okay but the slices are too thick. The slices should be slimmer. The sushi are too big that you can't put into the mouth in one go. I prefer Wa Zen for the price and quality,,,,The sashimi was okay but the slices are too thick. The slices should be slimmer. The sushi are too big that you can't put into the mouth in one go. I prefer Wa Zen for the price and quality,The sashimi was fine but the slices are too thick the slices should be slimmer the sushi is too big to put in the mouth in one go i prefer wa zen for the price and quality,negative
"Great Japanese food, definitely worth a try.",,,,"Great Japanese food, definitely worth a try.","Great Japanese food, definitely worth a try.",positive
Great Japanese Food. Must try,,,,Great Japanese Food. Must try,Great Japanese food.,positive
"Nice ambience and efficient service.Food (including the sashimi) was fresh, and good value. The staff were friendly and polite. Shortly after ordering, the food arrived one dish after another. Within moments, all our orders (for 2 adults and 2 kids) were served.We were walk-in diners. The manager (I think) was flexible enough to offer us a table that was reserved for 8 pm. And politely offered  that she will be able to offer us that table if we could finish our dinner by 8 pm. Now this is one service-oriented staff.Overall, a pleasant and nice dining experience.",,,,"Nice ambience and efficient service.Food (including the sashimi) was fresh, and good value. The staff were friendly and polite. Shortly after ordering, the food arrived one dish after another. Within moments, all our orders (for 2 adults and 2 kids) were served.We were walk-in diners. The manager (I think) was flexible enough to offer us a table that was reserved for 8 pm. And politely offered that she will be able to offer us that table if we could finish our dinner by 8 pm. Now this is one service-oriented staff.Overall, a pleasant and nice dining experience.","Nice atmosphere and efficient service.Food (including sashimi) was fresh, and good value.The staff were friendly and polite.Shortly after ordering, the food arrived one dish after another.In a few moments, all our orders (for 2 adults and 2 children) were served.We were walk-in diners.The manager (I think) was flexible enough to offer us a table that was reserved for 8 pm.And politely offered that she will be able to offer us that table if we could finish our dinner by 8 pm.Now this is one service-oriented staff.Overall, a pleasant and nice dining experience.",positive
"Nice place for sushi/japanese food! Very affordable, nice staff, good food. Will be back for sure!",,,,"Nice place for sushi/japanese food! Very affordable, nice staff, good food. Will be back for sure!","Very affordable, nice staff, good food.",positive
没讨厌的感觉，不错吃,,,,没讨厌的感觉，不错吃,"I don't hate it, I like to eat.",positive
Excellent service and food quality. Recommended and reasonable price.,,,,Excellent service and food quality. Recommended and reasonable price.,"Excellent service and food quality, recommended and reasonable price.",positive
"Tasty food, good environment",,,,"Tasty food, good environment","Delicious food, good environment",positive
Very nice!!,,,,Very nice!!,Very nice!!,positive
整体是不错，但价格越來越高，份量也变少了。,,,,整体是不错，但价格越來越高，份量也变少了。,"Overall, it's good, but the prices are getting higher and the shares are getting smaller.",positive
Oishi! Went for lunch. The lunch set consider more budget friendly! Reach and order before 1pm to get a free cawamushi for lunch set bento! We missed it.,,,,Oishi! Went for lunch. The lunch set consider more budget friendly! Reach and order before 1pm to get a free cawamushi for lunch set bento! We missed it.,Oishi! went to lunch. the lunch set consider more budget friendly! reach and order before 1 pm to get a free cawamushi for lunch set bento! we missed it.,positive
nice food & fresh,,,,nice food & fresh,Nice food & fresh,positive
"Yummy yummy. Very fresh sashimi and good variety of Japanese dishes. Good service, affordable pricing and nice ambience.",,,,"Yummy yummy. Very fresh sashimi and good variety of Japanese dishes. Good service, affordable pricing and nice ambience.","Yummy yummy, very fresh sashimi and a good variety of Japanese dishes, good service, affordable prices and nice ambiance.",positive
